{
  "schema_version": "0.1.0",
  "id": "01J9E6F7G8H9I0J1K2L3M4N5O6",
  "subject": "self",
  "predicate": "belief.architecture.style",
  "value": "event-sourced",
  "value_type": "enum",
  "confidence": 0.85,
  "valid_from": "2026-03-01T00:00:00Z",
  "valid_until": null,
  "supersedes": "01J8X7QK2M3N4P5Q6R7S8T9U0V",
  "source": {
    "tool": "contrail-cli",
    "session_id": null,
    "kind": "corrected"
  },
  "visibility": "private",
  "signature": null
}