{
  "schema_version": "0.1.0",
  "id": "01J9Z8QK3N4R5S6T7V8W9X0Y1Z",
  "subject": "self",
  "predicate": "preference.code_style.paradigm",
  "value": "functional-composition",
  "value_type": "enum",
  "confidence": 0.9,
  "valid_from": "2026-06-01T00:00:00Z",
  "valid_until": null,
  "supersedes": null,
  "source": {
    "tool": "claude-code",
    "session_id": "sess_a1b2",
    "kind": "explicit-statement"
  },
  "visibility": "private",
  "signature": null
}