{
  "schema_version": "0.1.0",
  "id": "01J9G8H9I0J1K2L3M4N5O6P7Q8",
  "subject": "self",
  "predicate": "preference.editor",
  "value": "vscode",
  "value_type": "enum",
  "confidence": 0.9,
  "valid_from": "2026-06-01T00:00:00Z",
  "valid_until": null,
  "supersedes": "01J8X7QK2M3N4P5Q6R7S8T9U0V",
  "source": {
    "tool": "claude-code",
    "session_id": "sess_a1b2",
    "kind": "explicit-statement"
  },
  "visibility": "private",
  "signature": null
}