{
  "schema_version": "0.1.0",
  "id": "01J9C4D5E6F7G8H9I0J1K2L3M4",
  "subject": "self",
  "predicate": "observation.session.quality",
  "value": "high",
  "value_type": "enum",
  "confidence": 0.7,
  "valid_from": "2026-07-16T14:30:00Z",
  "valid_until": "2026-07-16T15:00:00Z",
  "supersedes": null,
  "source": {
    "tool": "cursor",
    "session_id": "sess_e5f6",
    "kind": "inferred"
  },
  "visibility": "private",
  "signature": null
}